{
  "schema_version": 1,
  "name": "logistics",
  "display_name": "Logistics",
  "description": "A deeper transport and logistics simulation with meaningful industrial chains, network planning and city growth, while remaining recognisably OpenTTD.",
  "blueprint_version": "0.1.0",
  "openttd_min_version": "14.0",
  "gameplay": {
    "starting_year": 1950,
    "map_size": { "x": 1024, "y": 1024 },
    "cargodist": {
      "distribution_pax": "2",
      "distribution_mail": "2",
      "distribution_armoured": "1",
      "distribution_default": "1"
    },
    "vehicle": {
      "train_acceleration_model": "1",
      "roadveh_acceleration_model": "1",
      "wagon_speed_limits": "true"
    },
    "economy": {
      "inflation": "false",
      "infrastructure_maintenance": "true",
      "town_growth_rate": "2"
    },
    "town_growth": {
      "number_towns": "2"
    },
    "industry": {
      "industry_density": "4"
    }
  }
}
